{
  "name": "Dark Mage",
  "global_id": 15,
  "tribe": "Elemental Collective",
  "species": "harpy_angel",
  "age": 35,
  "roles": {
    "primary": "assassin",
    "secondary": "fat_trimmer"
  },
  "weapon_item": "Weapon_A15",
  "growth_curve": "late_bloomer",
  "brand_vibe": "A assassin from the Elemental Collective with harpy_angel heritage",
  "mat_list": [
    "earth",
    "electric"
  ],
  "move_list": [
    "move_A15_1",
    "move_A15_2",
    "move_A15_3",
    "move_A15_4"
  ]
}